{
  "schemaVersion": "1.0",
  "name": "qasey-real-qa-workflows-v1",
  "description": "从真实 QA 对话中提炼的、已脱敏的工作流级 golden dataset。金标是用户明确约束与当前 Qasey 安全/完成策略的组合，不把历史助手回复直接视为正确答案。",
  "records": [
    {
      "id": "qasey-gw-001",
      "status": "golden",
      "source": {
        "file": "evals/soruce_case/chat-export/20260811-1908_这个需求帮我写下case-这是设计稿-这是相关PR-MoeGolibrary-m.md",
        "excerpt": "这是群，你需要读一下slack的聊天记录"
      },
      "input": {
        "message": "这个需求帮我写 case。设计稿：{{FIGMA_URL}}；需要读取 Slack 频道 feature-payment-protecting；相关后端 PR：{{BACKEND_PR_1}}、{{API_PR_2}}。"
      },
      "groundTruth": {
        "route": { "intent": "case_create_full", "relation": "new", "writeTarget": "metersphere", "depth": "deep" },
        "objective": "综合设计、讨论和实现建立新需求用例，并写入 MeterSphere 后回查。",
        "mustInclude": [
          "读取 Figma、Slack 讨论和两份 PR，而不是只基于单一来源",
          "区分已验证事实、来源冲突和待确认项",
          "先形成覆盖模型，再生成少而精且可执行的用例",
          "写入 MeterSphere 后用新的读取结果核对数量、名称、优先级和目标模块"
        ],
        "mustNot": ["未读取来源就凭空补业务规则", "没有回查凭证却声称已写入成功", "泄露原始内部链接到无关输出"],
        "writePolicy": "metersphere_upsert",
        "readbackRequired": true,
        "clarification": null
      },
      "expectedTrajectory": {
        "requiredCapabilities": ["qa_context_read", "figma_read", "slack_read", "github_read", "metersphere_dry_run", "metersphere_write", "metersphere_readback"],
        "optionalCapabilities": ["qa_experience_read"],
        "forbiddenCapabilities": ["metersphere_delete", "git_write"],
        "terminalEvidence": ["immutable_case_plan", "successful_write_receipt", "fresh_readback_receipt"]
      },
      "metadata": { "workflow": "requirement_to_cases", "difficulty": "hard", "tags": ["multi-source", "figma", "slack", "github", "metersphere"] }
    },
    {
      "id": "qasey-gw-002",
      "status": "golden",
      "source": {
        "file": "evals/soruce_case/chat-export/20260804-1032_这个需求帮我写一下metersphere的case-这是设计稿.md",
        "excerpt": "这个需求帮我写一下metersphere的case"
      },
      "input": { "message": "这个需求帮我写 MeterSphere case：{{JIRA_URL}}；这是设计稿：{{FIGMA_URL}}。" },
      "groundTruth": {
        "route": { "intent": "case_create_full", "relation": "new", "writeTarget": "metersphere", "depth": "deep" },
        "objective": "从 Jira 与 Figma 形成新需求测试用例并完成 MeterSphere 写后回查。",
        "mustInclude": ["读取 Jira 的验收范围和关联信息", "读取 Figma 的交互、状态和文案", "冲突时以明确需求事实优先并记录冲突", "覆盖适用的状态、边界、失败恢复和回归范围"],
        "mustNot": ["把设计稿推断当成已确认规则", "只给 xlsx 而不执行用户明确要求的 MeterSphere 工作流", "无回查即宣告完成"],
        "writePolicy": "metersphere_upsert",
        "readbackRequired": true,
        "clarification": null
      },
      "expectedTrajectory": {
        "requiredCapabilities": ["qa_context_read", "jira_read", "figma_read", "metersphere_dry_run", "metersphere_write", "metersphere_readback"],
        "optionalCapabilities": ["github_read", "slack_read"],
        "forbiddenCapabilities": ["metersphere_delete"],
        "terminalEvidence": ["immutable_case_plan", "fresh_readback_receipt"]
      },
      "metadata": { "workflow": "requirement_to_cases", "difficulty": "hard", "tags": ["jira", "figma", "metersphere"] }
    },
    {
      "id": "qasey-gw-003",
      "status": "golden",
      "source": {
        "file": "evals/soruce_case/chat-export/20260807-1802_根据这个PR-帮我写一下metersphere的case.md",
        "excerpt": "根据这个PR，帮我写一下metersphere的case"
      },
      "input": { "message": "{{PR_URL}} 根据这个 PR，帮我写 MeterSphere case。" },
      "groundTruth": {
        "route": { "intent": "case_create_full", "relation": "new", "writeTarget": "metersphere", "depth": "deep" },
        "objective": "以 PR 实际改动为入口识别业务影响，生成并写入新用例。",
        "mustInclude": ["读取 PR diff、关联 issue 和改动调用链", "把代码影响翻译成业务场景", "明确 PR 未能说明的产品规则", "写入后回查"],
        "mustNot": ["只根据 PR 标题写 happy path", "要求用户手工导入而忽略已授权写入目标", "删除既有用例"],
        "writePolicy": "metersphere_upsert",
        "readbackRequired": true,
        "clarification": null
      },
      "expectedTrajectory": {
        "requiredCapabilities": ["qa_context_read", "github_read", "metersphere_read", "metersphere_dry_run", "metersphere_write", "metersphere_readback"],
        "optionalCapabilities": ["jira_read"],
        "forbiddenCapabilities": ["git_write", "metersphere_delete"],
        "terminalEvidence": ["pr_evidence", "fresh_readback_receipt"]
      },
      "metadata": { "workflow": "pr_to_cases", "difficulty": "hard", "tags": ["github", "impact-analysis", "metersphere"] }
    },
    {
      "id": "qasey-gw-004",
      "status": "golden",
      "source": {
        "file": "evals/soruce_case/chat-export/20260731-1020_你还记得之前让你写case的skill以及preauth的case吗-现在根据这.md",
        "excerpt": "现在根据这份文档写一下这部分case"
      },
      "input": {
        "message": "根据这份技术文档写 Pre-auth 二期的 case。",
        "attachments": [{ "name": "pre-auth-phase-2.pdf", "mimeType": "application/pdf", "source": "api" }]
      },
      "groundTruth": {
        "route": { "intent": "case_create_full", "relation": "follow_up", "writeTarget": "metersphere", "depth": "deep" },
        "objective": "复用既有 Pre-auth 业务背景，以新文档为当前事实源新增二期用例。",
        "mustInclude": ["读取附件中的明确规则", "复用仍有效的历史业务上下文但不覆盖新文档", "覆盖开关、状态、repeat appointment 与释放/结算边界", "写入后回查"],
        "mustNot": ["假装记得未读取的历史细节", "照搬一期全部用例", "无证据发明状态名"],
        "writePolicy": "metersphere_upsert",
        "readbackRequired": true,
        "clarification": null
      },
      "expectedTrajectory": {
        "requiredCapabilities": ["qa_context_read", "attachment_read", "metersphere_read", "metersphere_dry_run", "metersphere_write", "metersphere_readback"],
        "optionalCapabilities": ["qa_experience_read"],
        "forbiddenCapabilities": ["metersphere_delete"],
        "terminalEvidence": ["document_evidence", "fresh_readback_receipt"]
      },
      "metadata": { "workflow": "requirement_to_cases", "difficulty": "hard", "tags": ["attachment", "follow-up", "pre-auth"] }
    },
    {
      "id": "qasey-gw-005",
      "status": "golden",
      "source": {
        "file": "evals/soruce_case/chat-export/20260730-1738_你根据里历史写case的skill-现在需要你帮我重构payment的case-.md",
        "excerpt": "重点重构invoice V4的case"
      },
      "input": {
        "message": "重构 Payment / Invoice V4 的历史 case。输入包括两份全量导出、上一版重构结果和与另一个 agent 的讨论记录。需要自己检查历史需求是否已合并，不能重复。",
        "attachments": [
          { "name": "historical-cases-1.xlsx", "mimeType": "application/vnd.openxmlformats-officedocument.spreadsheetml.sheet", "source": "api" },
          { "name": "historical-cases-2.xlsx", "mimeType": "application/vnd.openxmlformats-officedocument.spreadsheetml.sheet", "source": "api" },
          { "name": "previous-refactor.xlsx", "mimeType": "application/vnd.openxmlformats-officedocument.spreadsheetml.sheet", "source": "api" },
          { "name": "review-transcript.md", "mimeType": "text/markdown", "source": "api" }
        ]
      },
      "groundTruth": {
        "route": { "intent": "case_maintain_fast", "relation": "new", "writeTarget": "metersphere", "depth": "standard" },
        "objective": "对已有 Invoice V4 用例做对账、去重、重组和缺口补齐，而不是凭空重写。",
        "mustInclude": ["建立历史用例与目标用例的稳定映射", "区分保留、改名、移动、合并、新增和失效", "保留仍有效的原用例身份", "先对账再 upsert 并回查"],
        "mustNot": ["把历史助手输出直接当金标", "按名称模糊匹配后批量误改", "删除既有用例", "为了结构整齐而丢失业务覆盖"],
        "writePolicy": "metersphere_upsert",
        "readbackRequired": true,
        "clarification": null
      },
      "expectedTrajectory": {
        "requiredCapabilities": ["qa_context_read", "attachment_read", "metersphere_read", "reconciliation", "metersphere_dry_run", "metersphere_write", "metersphere_readback"],
        "optionalCapabilities": ["qa_experience_read"],
        "forbiddenCapabilities": ["metersphere_delete"],
        "terminalEvidence": ["reconciliation_report", "immutable_case_plan", "fresh_readback_receipt"]
      },
      "metadata": { "workflow": "case_refactor", "difficulty": "hard", "tags": ["reconciliation", "deduplication", "invoice-v4", "history"] }
    },
    {
      "id": "qasey-gw-006",
      "status": "golden",
      "source": {
        "file": "evals/soruce_case/chat-export/20260628-2239_你还记得之前让你生成的测试用例的任务吗.md",
        "excerpt": "主要测试内容是已有的preauth数据，迁移后的测试点；以及Payment 回归点"
      },
      "input": {
        "priorContext": [{ "role": "user", "content": "结合之前的 Pre-auth case 和技术文档，生成 Pre-auth migration case。" }],
        "message": "上一版方向不对。主要测试已有 Pre-auth 数据迁移后的正确性，以及 Payment 回归；相关实现有 migration、skip migrated legacy preauth 和 data migration 等 PR。请重新生成。"
      },
      "groundTruth": {
        "route": { "intent": "case_maintain_fast", "relation": "follow_up", "writeTarget": "metersphere", "depth": "standard" },
        "objective": "按用户纠正后的范围重写迁移用例，聚焦存量数据迁移与支付回归。",
        "mustInclude": ["把存量数据迁移前后映射作为主轴", "覆盖幂等、跳过已迁移数据、失败恢复和数据完整性", "覆盖 Payment 主流程回归", "明确删除上一版不相关覆盖"],
        "mustNot": ["继续沿用上一版错误范围", "只测新创建 Pre-auth", "把实现 PR 名称当成产品预期"],
        "writePolicy": "metersphere_upsert",
        "readbackRequired": true,
        "clarification": null
      },
      "expectedTrajectory": {
        "requiredCapabilities": ["qa_context_read", "github_read", "metersphere_read", "case_diff", "metersphere_write", "metersphere_readback"],
        "optionalCapabilities": ["attachment_read"],
        "forbiddenCapabilities": ["metersphere_delete"],
        "terminalEvidence": ["scope_diff", "fresh_readback_receipt"]
      },
      "metadata": { "workflow": "case_scope_correction", "difficulty": "hard", "tags": ["migration", "regression", "follow-up", "user-correction"] }
    },
    {
      "id": "qasey-gw-007",
      "status": "golden",
      "source": {
        "file": "evals/soruce_case/chat-export/20260810-1710_继续之前之前写的package-retail支持split-payment的ca.md",
        "excerpt": "本次需求，需要区分不同账号，一级目录改成不同账号"
      },
      "input": {
        "message": "更新 Package/Retail Split Payment 用例，一级目录按账号能力分组：Invoice V4 + Membership 白名单支持 Sales create 的 Sell Product/Package Split Payment，也支持 created-but-unpaid 和历史 V0/V2 unpaid retail 进入新收银台继续支付；Invoice V4 非白名单不支持创建阶段 Split Payment，但支持 unpaid 后续支付；非 Invoice V4 另列。"